{
 "beams": [
  {
   "bid": "13:5",
   "lean": [
    -16.9927,
    12.5645
   ],
   "pal": "district_a",
   "phase": 0.8664,
   "pos": [
    -2.5,
    51.0,
    30.7127
   ],
   "sweep_deg": 0.0
  },
  {
   "bid": "14:13",
   "lean": [
    -15.3459,
    14.8968
   ],
   "pal": "district_b",
   "phase": 0.2875,
   "pos": [
    3.0,
    2.5,
    31.078
   ],
   "sweep_deg": 0.0
  },
  {
   "bid": "21:6",
   "lean": [
    15.2964,
    14.0386
   ],
   "pal": "accent_warm",
   "phase": 0.709,
   "pos": [
    45.0,
    45.0,
    37.3707
   ],
   "sweep_deg": 0.0
  },
  {
   "bid": "2:1",
   "lean": [
    -17.0368,
    14.9502
   ],
   "pal": "district_a",
   "phase": 0.676,
   "pos": [
    -69.0,
    75.0,
    39.7543
   ],
   "sweep_deg": 0.0
  },
  {
   "bid": "6:10",
   "lean": [
    -16.5523,
    11.5176
   ],
   "pal": "district_b",
   "phase": 0.8315,
   "pos": [
    -45.0,
    21.0,
    38.3025
   ],
   "sweep_deg": 0.0
  }
 ],
 "fog_fields": [
  {
   "density": 1.0,
   "id": "city",
   "max": [
    94.0,
    88.0,
    80.0
   ],
   "min": [
    -88.0,
    -94.0,
    0.0
   ]
  }
 ],
 "glows": [
  {
   "cell": [
    0,
    0
   ],
   "drift": [
    0.0257,
    -0.1003,
    -0.0145
   ],
   "pal": "district_a",
   "pos": [
    -52.8679,
    -20.9275,
    0.9
   ],
   "power": 0.7937
  },
  {
   "cell": [
    0,
    3
   ],
   "drift": [
    0.0733,
    -0.0061,
    0.0546
   ],
   "pal": "accent_warm",
   "pos": [
    -48.3052,
    -40.6021,
    0.9
   ],
   "power": 0.9668
  },
  {
   "cell": [
    0,
    5
   ],
   "drift": [
    -0.1009,
    0.0356,
    -0.0367
   ],
   "pal": "accent_warm",
   "pos": [
    -50.4608,
    -55.3098,
    0.9
   ],
   "power": 0.7634
  },
  {
   "cell": [
    0,
    6
   ],
   "drift": [
    -0.0542,
    0.082,
    -0.073
   ],
   "pal": "accent_warm",
   "pos": [
    -54.2121,
    -65.0302,
    0.9
   ],
   "power": 0.6805
  },
  {
   "cell": [
    1,
    0
   ],
   "drift": [
    0.0857,
    -0.0231,
    0.0861
   ],
   "pal": "district_a",
   "pos": [
    -39.3938,
    -18.8041,
    0.9
   ],
   "power": 0.5497
  },
  {
   "cell": [
    1,
    1
   ],
   "drift": [
    0.02,
    0.001,
    -0.0943
   ],
   "pal": "accent_warm",
   "pos": [
    -38.6499,
    -27.7455,
    0.9
   ],
   "power": 0.8456
  },
  {
   "cell": [
    1,
    2
   ],
   "drift": [
    0.0224,
    0.083,
    0.0416
   ],
   "pal": "district_a",
   "pos": [
    -41.0949,
    -37.4518,
    0.9
   ],
   "power": 0.5114
  },
  {
   "cell": [
    1,
    3
   ],
   "drift": [
    0.1199,
    -0.0146,
    0.0924
   ],
   "pal": "district_b",
   "pos": [
    -41.315,
    -44.7282,
    0.9
   ],
   "power": 0.5169
  },
  {
   "cell": [
    1,
    6
   ],
   "drift": [
    0.115,
    -0.0689,
    -0.1024
   ],
   "pal": "accent_cool",
   "pos": [
    -42.617,
    -63.7974,
    0.9
   ],
   "power": 0.5501
  },
  {
   "cell": [
    1,
    7
   ],
   "drift": [
    0.0771,
    -0.07,
    -0.0953
   ],
   "pal": "accent_warm",
   "pos": [
    -38.851,
    -69.6089,
    0.9
   ],
   "power": 0.5388
  },
  {
   "cell": [
    2,
    2
   ],
   "drift": [
    -0.0712,
    0.0881,
    -0.1156
   ],
   "pal": "accent_warm",
   "pos": [
    -35.0219,
    -35.4336,
    0.9
   ],
   "power": 0.5496
  },
  {
   "cell": [
    2,
    3
   ],
   "drift": [
    0.0898,
    -0.056,
    0.1034
   ],
   "pal": "accent_warm",
   "pos": [
    -35.021,
    -44.5873,
    0.9
   ],
   "power": 0.588
  },
  {
   "cell": [
    2,
    6
   ],
   "drift": [
    0.0278,
    -0.06,
    -0.11
   ],
   "pal": "accent_cool",
   "pos": [
    -33.5954,
    -65.6255,
    0.9
   ],
   "power": 0.5721
  },
  {
   "cell": [
    3,
    0
   ],
   "drift": [
    0.0605,
    -0.1021,
    0.0828
   ],
   "pal": "accent_cool",
   "pos": [
    -25.5517,
    -20.5014,
    0.9
   ],
   "power": 0.678
  },
  {
   "cell": [
    3,
    1
   ],
   "drift": [
    0.0423,
    0.0305,
    -0.1169
   ],
   "pal": "accent_cool",
   "pos": [
    -23.0418,
    -28.4898,
    0.9
   ],
   "power": 0.937
  },
  {
   "cell": [
    3,
    2
   ],
   "drift": [
    0.0827,
    0.1048,
    -0.0317
   ],
   "pal": "accent_warm",
   "pos": [
    -21.0697,
    -38.1549,
    0.9
   ],
   "power": 0.8026
  },
  {
   "cell": [
    3,
    3
   ],
   "drift": [
    -0.1062,
    -0.0408,
    0.0527
   ],
   "pal": "accent_cool",
   "pos": [
    -24.8116,
    -42.3467,
    0.9
   ],
   "power": 0.8478
  },
  {
   "cell": [
    3,
    4
   ],
   "drift": [
    0.0828,
    -0.0234,
    0.0851
   ],
   "pal": "accent_warm",
   "pos": [
    -24.6676,
    -52.0843,
    0.9
   ],
   "power": 0.7344
  },
  {
   "cell": [
    3,
    5
   ],
   "drift": [
    -0.0902,
    0.0124,
    -0.1008
   ],
   "pal": "district_a",
   "pos": [
    -25.0106,
    -57.8355,
    0.9
   ],
   "power": 0.5029
  },
  {
   "cell": [
    4,
    0
   ],
   "drift": [
    -0.0657,
    -0.0563,
    -0.0464
   ],
   "pal": "district_a",
   "pos": [
    -15.3643,
    -19.8429,
    0.9
   ],
   "power": 0.8447
  },
  {
   "cell": [
    4,
    1
   ],
   "drift": [
    -0.0687,
    -0.0477,
    -0.0235
   ],
   "pal": "district_a",
   "pos": [
    -14.4142,
    -30.7318,
    0.9
   ],
   "power": 0.9335
  },
  {
   "cell": [
    4,
    4
   ],
   "drift": [
    0.054,
    -0.0012,
    0.0916
   ],
   "pal": "district_b",
   "pos": [
    -15.626,
    -48.8402,
    0.9
   ],
   "power": 0.5122
  },
  {
   "cell": [
    4,
    6
   ],
   "drift": [
    0.0037,
    -0.0449,
    0.0528
   ],
   "pal": "district_a",
   "pos": [
    -13.0994,
    -62.7898,
    0.9
   ],
   "power": 0.7991
  },
  {
   "cell": [
    4,
    7
   ],
   "drift": [
    0.068,
    -0.1124,
    -0.0664
   ],
   "pal": "accent_warm",
   "pos": [
    -16.2836,
    -74.2456,
    0.9
   ],
   "power": 0.8972
  },
  {
   "cell": [
    5,
    0
   ],
   "drift": [
    -0.017,
    -0.0587,
    0.1052
   ],
   "pal": "district_b",
   "pos": [
    -5.5041,
    -20.5047,
    0.9
   ],
   "power": 0.7644
  },
  {
   "cell": [
    5,
    2
   ],
   "drift": [
    -0.0748,
    -0.0772,
    0.098
   ],
   "pal": "accent_warm",
   "pos": [
    -8.6728,
    -33.1441,
    0.9
   ],
   "power": 0.9516
  },
  {
   "cell": [
    5,
    3
   ],
   "drift": [
    -0.0756,
    -0.0815,
    -0.0121
   ],
   "pal": "accent_warm",
   "pos": [
    -5.0342,
    -42.8058,
    0.9
   ],
   "power": 0.6226
  },
  {
   "cell": [
    5,
    5
   ],
   "drift": [
    -0.0496,
    0.0564,
    -0.0054
   ],
   "pal": "accent_cool",
   "pos": [
    -7.7711,
    -56.753,
    0.9
   ],
   "power": 0.5068
  },
  {
   "cell": [
    5,
    7
   ],
   "drift": [
    -0.0744,
    -0.0204,
    0.1144
   ],
   "pal": "district_a",
   "pos": [
    -7.91,
    -69.9263,
    0.9
   ],
   "power": 0.957
  },
  {
   "cell": [
    6,
    0
   ],
   "drift": [
    0.092,
    -0.0215,
    -0.0904
   ],
   "pal": "accent_warm",
   "pos": [
    0.3286,
    -20.0904,
    0.9
   ],
   "power": 0.717
  },
  {
   "cell": [
    6,
    1
   ],
   "drift": [
    -0.0538,
    -0.0161,
    -0.0959
   ],
   "pal": "accent_warm",
   "pos": [
    -0.3045,
    -28.875,
    0.9
   ],
   "power": 0.862
  },
  {
   "cell": [
    6,
    2
   ],
   "drift": [
    0.0725,
    -0.0292,
    0.0705
   ],
   "pal": "accent_warm",
   "pos": [
    5.682,
    -33.8153,
    0.9
   ],
   "power": 0.5799
  },
  {
   "cell": [
    6,
    3
   ],
   "drift": [
    -0.1001,
    0.1109,
    0.0013
   ],
   "pal": "accent_warm",
   "pos": [
    4.5119,
    -45.0178,
    0.9
   ],
   "power": 0.7794
  },
  {
   "cell": [
    6,
    6
   ],
   "drift": [
    0.0405,
    -0.0218,
    0.0819
   ],
   "pal": "accent_warm",
   "pos": [
    0.5539,
    -64.6314,
    0.9
   ],
   "power": 0.6069
  },
  {
   "cell": [
    6,
    7
   ],
   "drift": [
    -0.0312,
    -0.0928,
    -0.0128
   ],
   "pal": "accent_warm",
   "pos": [
    -0.1892,
    -72.4604,
    0.9
   ],
   "power": 0.5651
  },
  {
   "cell": [
    7,
    0
   ],
   "drift": [
    -0.1005,
    -0.0602,
    -0.0275
   ],
   "pal": "accent_cool",
   "pos": [
    15.4285,
    -23.713,
    0.9
   ],
   "power": 0.5361
  },
  {
   "cell": [
    7,
    4
   ],
   "drift": [
    0.0144,
    0.1144,
    -0.0722
   ],
   "pal": "accent_warm",
   "pos": [
    8.7468,
    -52.6233,
    0.9
   ],
   "power": 0.9461
  },
  {
   "cell": [
    7,
    5
   ],
   "drift": [
    -0.1114,
    0.0115,
    -0.092
   ],
   "pal": "district_a",
   "pos": [
    13.4559,
    -58.9711,
    0.9
   ],
   "power": 0.5293
  },
  {
   "cell": [
    7,
    6
   ],
   "drift": [
    0.1051,
    0.004,
    0.0477
   ],
   "pal": "accent_warm",
   "pos": [
    14.7564,
    -63.4685,
    0.9
   ],
   "power": 0.7476
  },
  {
   "cell": [
    8,
    1
   ],
   "drift": [
    -0.0776,
    0.0905,
    -0.0061
   ],
   "pal": "district_a",
   "pos": [
    22.4404,
    -28.7835,
    0.9
   ],
   "power": 0.8345
  },
  {
   "cell": [
    8,
    2
   ],
   "drift": [
    0.0677,
    0.0651,
    0.0744
   ],
   "pal": "accent_cool",
   "pos": [
    23.1274,
    -34.9487,
    0.9
   ],
   "power": 0.7706
  },
  {
   "cell": [
    8,
    7
   ],
   "drift": [
    -0.0795,
    -0.0251,
    -0.0511
   ],
   "pal": "district_b",
   "pos": [
    19.3971,
    -73.8556,
    0.9
   ],
   "power": 0.7405
  },
  {
   "cell": [
    9,
    6
   ],
   "drift": [
    0.0816,
    -0.0046,
    -0.1067
   ],
   "pal": "accent_warm",
   "pos": [
    27.656,
    -62.3344,
    0.9
   ],
   "power": 0.9851
  },
  {
   "cell": [
    9,
    7
   ],
   "drift": [
    0.0654,
    -0.0153,
    -0.076
   ],
   "pal": "accent_cool",
   "pos": [
    30.9239,
    -73.5951,
    0.9
   ],
   "power": 0.599
  },
  {
   "cell": [
    10,
    1
   ],
   "drift": [
    -0.0403,
    -0.024,
    0.1013
   ],
   "pal": "accent_warm",
   "pos": [
    40.7421,
    -27.0469,
    0.9
   ],
   "power": 0.8836
  },
  {
   "cell": [
    10,
    2
   ],
   "drift": [
    0.0646,
    0.064,
    0.0848
   ],
   "pal": "accent_warm",
   "pos": [
    41.6623,
    -37.4335,